{"schema_version":"1.0.0","revision_id":"00000000-0000-7000-8000-000000000002","revision_hash":"0000000000000000000000000000000000000000000000000000000000000000","hash_algorithm":"sha-256","canonicalization":"jcs-rfc8785","parent_revision_id":null,"operation_id":"00000000-0000-7000-8000-000000000004","actor":{"actor_type":"human","actor_id":"alice","identity_source":"explicit_fallback","authenticated":false},"operation":{"type":"start_review","target_ids":[],"content_digest":null},"created_at":"2026-09-11T00:00:00Z","revision_payload":{"intent_id":"00000000-0000-7000-8000-000000000001","lifecycle_state":"draft","source_references":[{"source_reference_id":"00000000-0000-7000-8000-000000000003","kind":"fixture","locator":"fixture.json","content_hash":null,"excerpt":null}],"items":[{"item_id":"00000000-0000-7000-8000-000000000006","kind":"goal","statement":"レビュー可能にする","provenance":{"content_origin":"source","operation_actor":null,"operation_id":"00000000-0000-7000-8000-000000000004","operation_type":"fixture_import","revision_id":"00000000-0000-7000-8000-000000000002","source_reference_ids":["00000000-0000-7000-8000-000000000003"]},"resolution_status":"determined","review_status":"unreviewed","included_in_approval":true,"rationale":null,"source_reference_ids":["00000000-0000-7000-8000-000000000003"],"supersedes":[],"superseded_by":[]}],"comments":[],"approval_refs":[]}}
