{
  "schema_version": "1.0.0",
  "revision_id": "01900000-0000-7000-8000-000000000001",
  "revision_hash": "0000000000000000000000000000000000000000000000000000000000000000",
  "hash_algorithm": "sha-256",
  "canonicalization": "jcs-rfc8785",
  "parent_revision_id": null,
  "operation_id": "01900000-0000-7000-8000-000000000002",
  "actor": {
    "actor_type": "human",
    "actor_id": "fixture",
    "identity_source": "explicit_fallback",
    "authenticated": false
  },
  "operation": {"type": "start_review", "target_ids": []},
  "created_at": "2026-01-01T00:00:00Z",
  "revision_payload": {
    "intent_id": "01900000-0000-7000-8000-000000000003",
    "lifecycle_state": "draft",
    "source_references": [],
    "items": [
      {
        "item_id": "01900000-0000-7000-8000-000000000004",
        "kind": "goal",
        "statement": "Review this Intent item",
        "provenance": {
          "content_origin": "source",
          "operation_actor": null,
          "operation_id": "01900000-0000-7000-8000-000000000002",
          "operation_type": "fixture_import",
          "revision_id": "01900000-0000-7000-8000-000000000001",
          "source_reference_ids": []
        },
        "resolution_status": "determined",
        "review_status": "unreviewed",
        "included_in_approval": true,
        "rationale": null,
        "source_reference_ids": [],
        "supersedes": [],
        "superseded_by": []
      }
    ],
    "comments": [],
    "approval_refs": []
  }
}
